Attribute,Description,Valid Values,DependsOn,Properties,Required,Parent,DependsOn Component,Source,Validation Rules
Sequencing,Module for next generation sequencing assays,"","","",FALSE,Assay,"",http://example.org/htan/Sequencing,""
Sequencing Platform,A platform is an object aggregate that is the set of instruments and software needed to perform a process [OBI_0000050]. Specific model of the sequencing instrument.,"Illumina Next Seq 500, Illumina Next Seq 550, Illumina Next Seq 2500, Illumina NovaSeq 6000,  Illumina MiSeq, 454 GS FLX Titanium, AB SOLiD 4 AB SOLiD 2, AB SOLiD 3, Complete Genomics, Illumina HiSeq X Ten, Illumina HiSeq X Five, Illumina Genome Analyzer II, Illumina Genome Analyzer IIx, Illumina HiSeq 2000, Illumina HiSeq 2500, Illumina HiSeq 4000, Illumina MiSeq, Illumina NextSeq, Ion Torrent PGM, Ion Torrent Proton, Ion Torrent S5, PacBio RS, NovaSeq 6000, NovaSeqS4, Ultima Genomics UG100, Oxford Nanopore minION, GridION, PromethION, PacBio Sequel2, Revio, Other, unknown, Not Reported",,,TRUE,Device,,https://docs.gdc.cancer.gov/Data_Dictionary/viewer/#?view=table-definition-view&id=read_group,
Library Construction Method,Process which results in the creation of a library from fragments of DNA using cloning vectors or oligonucleotides with the role of adaptors [OBI_0000711],"Smart-seq2, Smart-SeqV4, 10xV1.0, 10xV1.1, 10xV2, 10xV3,10xV3.1, CEL-seq2, Drop-seq, inDropsV2, inDropsV3, TruDrop, sci-ATAC-seq",,,TRUE,Sequencing,,http://purl.obolibrary.org/obo/OBI_0000711,
Nucleic Acid Source,The source of the input nucleic molecule,"Single Cell, Bulk Whole Cell, Single Nucleus, Bulk Nuclei",,,TRUE,Sequencing,,http://example.org/htan/NucleicAcidSource,
Read1,Read 1 content description,"Cell Barcode and DNA Insert, Sample Index and DNA Insert, DNA Insert, Sample Index, Cell Barcode","","",TRUE,Sequencing,"","",""
Read2,Read 2 content description,"Cell Barcode and DNA Insert, Sample Index and DNA Insert, DNA Insert, Sample Index, Cell Barcode","","",TRUE,Sequencing,"","",""
Technical Replicate Group,A common term for all files belonging to the same cell or library. Provide a numbering of each library prep batch (can differ from encapsulation and sequencing batch),,,,FALSE,Sequencing,,,
Sequencing Batch ID,Links samples to a specific local sequencer run. Can be string or 'null',,,,TRUE,Sequencing,,,
Total Reads,Total number of reads per sample. Integer,,,,FALSE,Sequencing,,https://docs.gdc.cancer.gov/Data_Dictionary/viewer/#?view=table-definition-view&id=read_group_qc,
